### ISSUE TITLE
Google cloud vision does not work behind proxy and self-managed SSL

### ISSUE THREAD

**Issue by nhunh585** [googleapis/google-cloud-python#10486]
**Issue**

Now I am using google cloud (behind proxy) vision to detect text in the image.

**Environment variables**

```
export HTTP_PROXY="http://username:pass@10.16.29.21:8080"
export HTTPS_PROXY="http://username:pass@10.16.29.21:8080"
export REQUESTS_CA_BUNDLE=/home/test/certificate.cer
export SSL_CERT_FILE=/home/test/certificate.cer
```

**My code**
```
os.environ['GOOGLE_APPLICATION_CREDENTIALS']='./json.json'
def google_ocr(image_file):
    try:
        # Instantiates a client
        client = vision.ImageAnnotatorClient()

        # Loads the image into memory
        with io.open(image_file, 'rb') as image_file:
            content = image_file.read()

        image = types.Image(content=content)

        # Performs label detection on the image file
        response = client.text_detection(image=image,
                                         image_context={"language_hints": ["en"]},)

        annotations = response.text_annotations
        if len(annotations) > 0:
            text = annotations[0].description
        else:
            text = ''

        print(text)

        return text
    except Exception as e:
        print(e)
        raise Exception

image = "./IMG.PNG"

print(google_ocr(image))

```

**But there following error:**

```
D0904 17:14:26.604910755   25602 ev_posix.cc:175]            Using polling engine: epollex
D0904 17:14:26.604977752   25602 lb_policy_registry.cc:40]   registering LB policy factory for "grpclb"
D0904 17:14:26.604984805   25602 lb_policy_registry.cc:40]   registering LB policy factory for "cds_experimental"
D0904 17:14:26.604992289   25602 lb_policy_registry.cc:40]   registering LB policy factory for "eds_experimental"
D0904 17:14:26.604996046   25602 lb_policy_registry.cc:40]   registering LB policy factory for "lrs_experimental"
D0904 17:14:26.604999302   25602 lb_policy_registry.cc:40]   registering LB policy factory for "priority_experimental"
D0904 17:14:26.605002428   25602 lb_policy_registry.cc:40]   registering LB policy factory for "weighted_target_experimental"
D0904 17:14:26.605006536   25602 lb_policy_registry.cc:40]   registering LB policy factory for "xds_routing_experimental"
D0904 17:14:26.605008991   25602 lb_policy_registry.cc:40]   registering LB policy factory for "pick_first"
D0904 17:14:26.605012417   25602 lb_policy_registry.cc:40]   registering LB policy factory for "round_robin"
D0904 17:14:26.605014902   25602 dns_resolver_ares.cc:507]   Using ares dns resolver
I0904 17:14:46.652944635   25632 subchannel.cc:1033]         Connect failed: {"created":"@1599214486.652892116","description":"Failed to connect to remote host: FD Shutdown","file":"src/core/lib/iomgr/lockfree_event.cc","file_line":195,"os_error":"Timeout occurred","referenced_errors":[{"created":"@1599214486.652880073","description":"connect() timed out","file":"src/core/lib/iomgr/tcp_client_posix.cc","file_line":113}],"target_address":"ipv4:172.217.26.138:443"}
I0904 17:14:46.653047319   25632 subchannel.cc:1033]         Connect failed: {"created":"@1599214486.653027010","description":"Network is unreachable","errno":101,"file":"src/core/lib/iomgr/tcp_client_posix.cc","file_line":296,"os_error":"Network is unreachable","syscall":"connect","target_address":"ipv6:[2404:6800:4005:808::200a]:443"}
I0904 17:14:46.653062938   25632 subchannel.cc:970]          Subchannel 0x1636680: Retry immediately
I0904 17:14:46.653069190   25632 subchannel.cc:997]          Failed to connect to channel, retrying
503 failed to connect to all addresses
Traceback (most recent call last):
  File "/home/atom_test/.local/lib/python3.6/site-packages/google/api_core/grpc_helpers.py", line 57, in error_remapped_callable
    return callable_(*args, **kwargs)
  File "/home/atom_test/.local/lib/python3.6/site-packages/grpc/_channel.py", line 826, in __call__
    return _end_unary_response_blocking(state, call, False, None)
  File "/home/atom_test/.local/lib/python3.6/site-packages/grpc/_channel.py", line 729, in _end_unary_response_blocking
    raise _InactiveRpcError(state)
grpc._channel._InactiveRpcError: <_InactiveRpcError of RPC that terminated with:
	status = StatusCode.UNAVAILABLE
	details = "failed to connect to all addresses"
	debug_error_string = "{"created":"@1599214486.653060353","description":"Failed to pick subchannel","file":"src/core/ext/filters/client_channel/client_channel.cc","file_line":4090,"referenced_errors":[{"created":"@1599214486.653058420","description":"failed to connect to all addresses","file":"src/core/ext/filters/client_channel/lb_policy/pick_first/pick_first.cc","file_line":394,"grpc_status":14}]}"
```

**Here is network package capture**

```
17:14:26.654152 IP System-Product-Name.51852 > hkg12s21-in-f10.1e100.net.https: Flags [S], seq 2069919229, win 64240, options [mss 1460,sackOK,TS val 2735503221 ecr 0,nop,wscale 7], length 0
17:14:27.667848 IP System-Product-Name.51852 > hkg12s21-in-f10.1e100.net.https: Flags [S], seq 2069919229, win 64240, options [mss 1460,sackOK,TS val 2735504235 ecr 0,nop,wscale 7], length 0
17:14:29.683836 IP System-Product-Name.51852 > hkg12s21-in-f10.1e100.net.https: Flags [S], seq 2069919229, win 64240, options [mss 1460,sackOK,TS val 2735506251 ecr 0,nop,wscale 7], length 0
17:14:33.811859 IP System-Product-Name.51852 > hkg12s21-in-f10.1e100.net.https: Flags [S], seq 2069919229, win 64240, options [mss 1460,sackOK,TS val 2735510379 ecr 0,nop,wscale 7], length 0
17:14:42.004065 IP System-Product-Name.51852 > hkg12s21-in-f10.1e100.net.https: Flags [S], seq 2069919229, win 64240, options [mss 1460,sackOK,TS val 2735518571 ecr 0,nop,wscale 7], length 0
17:14:46.653117 IP System-Product-Name.52098 > hkg12s21-in-f10.1e100.net.https: Flags [S], seq 3739133444, win 64240, options [mss 1460,sackOK,TS val 2735523220 ecr 0,nop,wscale 7], length 0
```
